ffff88016cd3f480 3225644993 S Co:003:00 s 21 09 0200 0000 0008 8 = a1000020 a1000020
ffff88016cd3f480 3225650506 C Co:003:00 0 8 >                                       
ffff88016cd3fe40 3225668509 C Ii:003:01 0 8 = 55aaffff ffffffff                     
ffff88016cd3fe40 3225669446 S Ii:003:01 -115 8 <                                    
ffff88016cd3fe40 3225676509 C Ii:003:01 0 8 = ffffffff ffffffff                     
ffff88016cd3fe40 3225679478 S Ii:003:01 -115 8 <                                    
ffff88016cd3fe40 3225684538 C Ii:003:01 0 8 = 0a200840 81000000                     
ffff88016cd3fe40 3225687834 S Ii:003:01 -115 8 <                                    
ffff88016cd3fe40 3225692508 C Ii:003:01 0 8 = 810000f0 0f001068                     
ffff88016cd3fe40 3225693415 S Co:003:00 s 21 09 0200 0000 0008 8 = a1002020 a1002020
ffff88016cd3fe40 3225698509 C Co:003:00 0 8 >                                       
ffff88016cd3fe40 3225701582 S Ii:003:01 -115 8 <                                    
ffff88016cd3fe40 3225716518 C Ii:003:01 0 8 = bd277427 00000000                     
ffff88016cd3fe40 3225725650 S Ii:003:01 -115 8 <                                    
ffff88016cd3fe40 3225732518 C Ii:003:01 0 8 = 00000010 01111841                     
ffff88016cd3fe40 3225734339 S Ii:003:01 -115 8 <                                    
ffff88016cd3fe40 3225740542 C Ii:003:01 0 8 = 4123c800 0000462d                     
ffff88016cd3fe40 3225751206 S Ii:003:01 -115 8 <                                    
ffff88016cd3fe40 3225756520 C Ii:003:01 0 8 = 2c016480 c8000000                     
ffff88016cd3fe40 3225757986 S Co:003:00 s 21 09 0200 0000 0008 8 = a1004020 a1004020
ffff88016cd3f480 3225758913 S Ii:003:01 -115 8 <                                    
ffff88016cd3fe40 3225763525 C Co:003:00 0 8 >                                       
ffff88016cd3f480 3225780527 C Ii:003:01 0 8 = 64006480 a0288025                     
ffff88016cd3f480 3225783374 S Ii:003:01 -115 8 <                                    
ffff88016cd3f480 3225788523 C Ii:003:01 0 8 = 00000000 03790005                     
ffff88016cd3f480 3225791867 S Ii:003:01 -115 8 <                                    
ffff88016cd3f480 3225796527 C Ii:003:01 0 8 = ef00000a 00f40112                     
ffff88016cd3f480 3225800951 S Ii:003:01 -115 8 <                                    
ffff88016cd3f480 3225804527 C Ii:003:01 0 8 = 00000000 00000000                     
ffff88016cd3f480 3225811437 S Ii:003:01 -115 8 <                                    
ffff88016cd3fe40 3225814100 S Co:003:00 s 21 09 0200 0000 0008 8 = a1006020 a1006020
ffff88016cd3fe40 3225819531 C Co:003:00 0 8 >                                       
ffff88016cd3f480 3225836536 C Ii:003:01 0 8 = 00005218 631b3901                     
ffff88016cd3f480 3225844531 S Ii:003:01 -115 8 <                                    
ffff88016cd3f480 3225852536 C Ii:003:01 0 8 = 2c005001 5c805001                     
ffff88016cd3f480 3225854609 S Ii:003:01 -115 8 <                                    
ffff88016cd3f480 3225860534 C Ii:003:01 0 8 = 5c80ed00 f8ff3528                     
ffff88016cd3f480 3225864341 S Ii:003:01 -115 8 <                                    
ffff88016cd3f480 3225868535 C Ii:003:01 0 8 = 74257e28 bd255200                     
ffff88016cd3f480 3225869621 S Co:003:00 s 21 09 0200 0000 0008 8 = a1008020 a1008020
ffff88016cd3fe40 3225872248 S Ii:003:01 -115 8 <                                    
ffff88016cd3f480 3225875541 C Co:003:00 0 8 >                                       
ffff88016cd3fe40 3225892551 C Ii:003:01 0 8 = 9900e802 e802e802                     
ffff88016cd3fe40 3225897394 S Ii:003:01 -115 8 <                                    
ffff88016cd3fe40 3225900543 C Ii:003:01 0 8 = d2066516 00090903                     
ffff88016cd3fe40 3225905946 S Ii:003:01 -115 8 <                                    
ffff88016cd3fe40 3225908544 C Ii:003:01 0 8 = 04260901 10002909                     
ffff88016cd3fe40 3225916560 S Ii:003:01 -115 8 <                                    
ffff88016cd3fe40 3225924553 C Ii:003:01 0 8 = 11282005 09060214                     
ffff88016cd3fe40 3225928664 S Ii:003:01 -115 8 <                                    
ffff88016cd3f480 3225928692 S Co:003:00 s 21 09 0200 0000 0008 8 = a100a020 a100a020
ffff88016cd3f480 3225934556 C Co:003:00 0 8 >                                       
ffff88016cd3fe40 3225948554 C Ii:003:01 0 8 = 31090702 16100901                     
ffff88016cd3fe40 3225954370 S Ii:003:01 -115 8 <                                    
ffff88016cd3fe40 3225956582 C Ii:003:01 0 8 = 10195909 07011339                     
ffff88016cd3fe40 3225965929 S Ii:003:01 -115 8 <                                    
ffff88016cd3fe40 3225972560 C Ii:003:01 0 8 = 09011001 43090701                     
ffff88016cd3fe40 3225977662 S Ii:003:01 -115 8 <                                    
ffff88016cd3fe40 3225980590 C Ii:003:01 0 8 = 13390901 10014307                     
ffff88016cd3fe40 3225982570 S Co:003:00 s 21 09 0200 0000 0008 8 = a100c020 a100c020
ffff88016cd3f480 3225986808 S Ii:003:01 -115 8 <                                    
ffff88016cd3fe40 3225988573 C Co:003:00 0 8 >                                       
ffff88016cd3f480 3226004566 C Ii:003:01 0 8 = 06290227 10011118                     
ffff88016cd3f480 3226011238 S Ii:003:01 -115 8 <                                    
ffff88016cd3f480 3226012592 C Ii:003:01 0 8 = 41090911 07390901                     
ffff88016cd3f480 3226020818 S Ii:003:01 -115 8 <                                    
ffff88016cd3f480 3226028569 C Ii:003:01 0 8 = 23045709 09110739                     
ffff88016cd3f480 3226033557 S Ii:003:01 -115 8 <                                    
ffff88016cd3f480 3226036596 C Ii:003:01 0 8 = 09012304 57091114                     
ffff88016cd3f480 3226037666 S Co:003:00 s 21 09 0200 0000 0008 8 = a100e020 a100e020
ffff88016cd3fe40 3226042080 S Ii:003:01 -115 8 <                                    
ffff88016cd3f480 3226043581 C Co:003:00 0 8 >                                       
ffff88016cd3fe40 3226060571 C Ii:003:01 0 8 = 10250911 14102509                     
ffff88016cd3fe40 3226065817 S Ii:003:01 -115 8 <                                    
ffff88016cd3fe40 3226068573 C Ii:003:01 0 8 = 09190219 09091902                     
ffff88016cd3fe40 3226076417 S Ii:003:01 -115 8 <                                    
ffff88016cd3fe40 3226084576 C Ii:003:01 0 8 = 19090919 02190912                     
ffff88016cd3fe40 3226087656 S Ii:003:01 -115 8 <                                    
ffff88016cd3fe40 3226092613 C Ii:003:01 0 8 = 02193409 12021934                     
ffff88016cd3fe40 3226095630 S Co:003:00 s 21 09 0200 0000 0008 8 = a1681020 a1681020
ffff88016cd3f480 3226097187 S Ii:003:01 -115 8 <                                    
ffff88016cd3fe40 3226101576 C Co:003:00 0 8 >                                       
ffff88016cd3f480 3226116623 C Ii:003:01 0 8 = 05338c00 5d020074                     
ffff88016cd3f480 3226120982 S Ii:003:01 -115 8 <                                    
ffff88016cd3f480 3226124581 C Ii:003:01 0 8 = 27000000 00790700                     
ffff88016cd3f480 3226133931 S Ii:003:01 -115 8 <                                    
ffff88016cd3f480 3226140588 C Ii:003:01 0 8 = 0a3e9300 631d00a2                     
ffff88016cd3f480 3226142186 S Ii:003:01 -115 8 <                                    
ffff88016cd3f480 3226148587 C Ii:003:01 0 8 = 27000000 0c790700                     
ffff88016cd3f480 3226153602 S Ii:003:01 -115 8 < 

